ID,Area,Feature,User Story,Expected Behavior,Status,Errors / Notes,Test Method,Last Updated
126,Shell,Bracket Settlement UI,"As a bracket pool player I want to see confirmed entries, payout status, audit hashes, and recipient addresses so that I can verify settlement transparency.","`app.js:3188-3230` renders Tether WDK rail card, pool card, entry ledger, payout recipient list, and audit card.
`app.js:1932-1962` renders each entrant with status label and proof id.
`app.js:1964-1972` maps processor statuses to labels (`Quoted`, `Broadcast`, `Prepared`, `Needs address`, `Held`).",pass,"Covered by automated test suite (350 pass, 0 fail)",npm test,2026-07-08
127,Games,Game Settlement UI,"As a mini-game player I want to see the escrow, QVAC attestation, and payout after a round so that I know whether I won the stake.","`app.js:4126-4314` creates escrow, submits commitments/reveals/state hashes, calls `settleGameRoundWithReceipt`, and renders `qvacAttestation`, `tetherEscrow`, and `tetherPayout`.
`postSettlementReceipt` (`app.js:1040-`) updates `state.wallet.pendingPayout` and shows a win/draw/loss toast.",pass,"Covered by automated test suite (350 pass, 0 fail)",npm test,2026-07-08
128,Settlement,Sponsor Prize Fulfillment,As a sponsor-prize winner I want to claim and track fulfillment of my non-cash prize so that I receive it after settlement.,"`src/settlement-engine.js:174-215` creates/updates `SponsorPrizeFulfillment` records with statuses `pending`, `claimed`, `fulfilled`, `disputed`, `cancelled`.
`wallet-ops-engine.js:223-270` exposes command drafts for claim/fulfill/dispute.",pass,"Covered by automated test suite (350 pass, 0 fail)",npm test,2026-07-08
129,Shell,FIT Selection & Loading,As a player I want the tournament shell to load the correct event theme from a link so that the UI matches the server I joined.,"`fit-loader.js` reads `?fit=<id>` or `window.ULTIMATE_SPORTS_FIT`, looks it up in `ULTIMATE_FIT_REGISTRY`, and falls back to `world-cup` if missing. It sets `window.CURRENT_FIT_ID`, `window.ULTIMATE_FIT_CONFIG`, and the document title.",pass,App loaded with ?fit=mma-boxing-fight-card and applied fit config,visual audit,2026-07-08
130,Shell / Backend,FIT Registry / Event Fit Catalog,"As an operator I want a catalog of reusable event templates (World Cup, March Madness, MMA, etc.) so that each tournament reuses the right data shape and assets.","`fits/_registry.js` provides `registerFit` and `defaultFitAssets`. `world-cup.js`, `generic-fits.js`, `mma-boxing-fight-card.js`, `awards-prediction-pools.js`, and `group-stage-fits.js` register 12 fits with `templateKind`, `teams`, `pools`, `theme`, etc. `src/catalog-engine.js` exposes `listEventFits` / `getEventFit`.",pass,Fit registry loaded and rendered fight-card theme,visual audit,2026-07-08
131,Shell,Theme Token Injection,As a player I want the shell to use the event’s color palette so that the brand feels specific to the tournament.,"`fit-loader.js` writes the fit’s `theme` object (e.g. `--ink`, `--surface`, `--green`, `--gold`) as inline CSS custom properties on `<html>`. `styles.css` consumes these tokens across surfaces, lines, and accents.",pass,Theme tokens applied correctly in light and dark modes,visual audit,2026-07-08
132,Shell,Neutral Client Skin with Fit Accent,As a P2P client user I want a consistent window chrome that still shows the server’s identity color so that I know which server I’m in.,"`client-skin.css` forces a neutral light/dark Win9x/Winamp-style chrome with `!important` and uses `--server-accent` (derived from the fit theme) for brand mark, selected states, buttons, and highlights.",pass,Win9x/Napster skin applied with fit-specific accent colors,visual audit,2026-07-08
133,Shell,Fit-Specific Dark Background,"As a player I want dark-themed events (MMA, awards) to have a dark page background so that the UI feels cohesive.","When a fit defines `background`, `fit-loader.js` adds the `fit-dark` class and sets `document.body.style.background`. `styles.css` suppresses the default bubble field via `.fit-dark::before { display:none }`.",pass,Dark mode renders fit-specific backgrounds,visual audit,2026-07-08
134,Shell,Arcade Theme for Combat Fits,As a fight-card player I want a Street Fighter-style VS screen and broadcast stage so that the combat event feels like a fight night.,"When a fit has an `arcade` block, `fit-loader.js` adds the `fit-arcade` class and injects an arcade VS screen into `#home .live-command` and a fight broadcast into `#watch .stadium-tv`. `client-skin.css` styles `.arcade-vs`, `.tv-fight`, and hides the soccer pitch/board.",pass,Arcade/combat theme rendered for MMA boxing fight card,visual audit,2026-07-08
135,Shell,Lazy Fit Asset Loading,As a mobile player I want heavy raster images to load only when needed so that the initial load stays fast.,"`lazy-fit-assets.js` observes `img[data-lazy-src]`, `source[data-lazy-srcset]`, and `[data-lazy-bg]` and upgrades them when they intersect a 200px root margin or the tab is hidden. `app.js` calls `window.LazyFitAssets.observe()` during boot if present.",pass,Fit assets loaded on demand without blocking boot,visual audit,2026-07-08
136,Shell,Hero Backdrop Asset Application,As a player I want the home hero to show a backdrop image specific to the event so that the landing screen feels branded.,`renderHomeHero()` in `app.js` reads `cfg.assets.heroBackdrop` from `ULTIMATE_FIT_CONFIG` and sets it as the background image of `#heroBackdrop`.,pass,Hero backdrop asset visible in home and watch views,visual audit,2026-07-08
137,Games,Fit-Aware Mini-Game Recommendations,As a player I want the Games tray to show mini-games relevant to the sport so that I can pick appropriate challenges.,"`fit-loader.js` populates `cfg.recommendedMiniGames` per fit (e.g. soccer gets `penalty-clash`, `free-kick-duel`; basketball gets `buzzer-beater-duel`). `app.js` uses these as the default list and exposes `ULTIMATE_MINI_GAME_TITLES` for display names.",pass,Mini-game tabs reflect fit-aware recommendations,visual audit,2026-07-08
138,Games,Fit-Aware Prediction Options,As a player I want prediction-duel options to match the event (e.g. KO/TKO/Decision for MMA) so that props make sense.,"`fit-loader.js` sets `cfg.predictionOptions` per fit. `peer-match.js` exposes them via `predictionOptions()`, and the live-market/prediction UI renders the options.",pass,Prediction options reflect fight-card fit,visual audit,2026-07-08
139,Games / Peer Match,Fit-Aware Trivia Bank,As a player I want trivia questions to be about the event I’m watching so that the trivia duel feels relevant.,`fit-loader.js` ships `ULTIMATE_TRIVIA_BANK` with 6 questions per fit. `peer-match.js` hashes the bank with `currentFitId()` and distributes it to peers for the trivia duel.,pass,"Covered by automated test suite (350 pass, 0 fail)",npm test,2026-07-08
140,Shell,Template Kind Rendering,"As a player I want the bracket/pick board to match the tournament format (knockout tree, group stage, fight card, awards card, etc.) so that I make the right kind of picks.","`app.js` reads `templateKind` from the fit config and switches rendering: `single-elimination`, `group-plus-knockout`, `series-playoff`, `round-robin`, `fight-card`, `awards-card`, or `creator-custom`. Board titles also update accordingly.",pass,Fit-specific templates rendered correctly,visual audit,2026-07-08
141,Lobby,Server Card Cover in Lobby,As a player browsing servers I want each server to show a themed cover image so that I can recognize the event visually.,"`lobby-app/app.js` renders each server row with `<img class=""srv-cover"" src=""..."">` using `server.coverUrl` from `data/servers.json`. The URLs point to `generated-assets/<fitId>/server-card-cover/cover.jpg`.",pass,Server card covers rendered in lobby browser,visual audit,2026-07-08
142,Lobby,FIT Format Badges in Lobby,As a player I want to see the tournament format at a glance so that I know what kind of pool I’m joining.,"`lobby-app/app.js` maps `fitId` to a human-readable format via `FIT_FORMATS` (e.g. `mma-boxing-fight-card` → `Fight card`, `awards-prediction-pools` → `Awards card`).",pass,Format badges rendered in server table,visual audit,2026-07-08
143,Asset Pipeline,Fit Asset Pack Generation,As an operator I want to generate all required images for a new event fit so that the shell and lobby have consistent artwork.,"`scripts/generate-fit-assets.js` builds a generation plan from `catalog-engine` and `tournament-experience-engine`, then creates 9 asset types per fit: 6 raster images via BigModel (`cogView-4`) and 3 local SVGs (lobby icon, pool accent, mini-game icon set). Supports `--fit`, `--all`, `--force`, `--dry-run`.",not tested,Build-time asset pipeline; verified via smoke:fits (73/73),manual review,2026-07-08
144,Backend,Tournament Experience Profiles,"As an operator I want each fit to carry experience metadata (skin name, visual tone, palette, live prompts) so that generated assets and UI descriptions stay consistent.","`src/tournament-experience-engine.js` defines 12 profiles with `serverSkin`, `visualTone`, `palette`, `apiAdapters`, `livePromptLexicon`, `customPanels`, `shellId`, `layoutMode`, and `bracketStyle`. These drive asset prompts and the operator dashboard.",not tested,Backend configuration; no runtime UI to exercise,manual review,2026-07-08
145,Operator,Operator Fit Readiness Dashboard,As an operator I want to see which fits are launchable and where assets stand so that I can decide what to ship.,"`app/app.js` renders the fit catalog, a fit readiness matrix (`fitReadinessPanel`) with asset/status columns, the tournament experience, GUI shell details, and an asset queue.",not tested,Operator dashboard not exposed in standard user flow,manual review,2026-07-08
146,Peer Match,Peer Match Fit Context,As a peer-to-peer player I want the game to use the current fit’s question bank and prediction options so that my opponent and I are playing the same event.,"`peer-match.js` reads `root.CURRENT_FIT_ID` and `root.ULTIMATE_FIT_CONFIG` to build the trivia bank and prediction options, and includes `fitId` in commitments and state hashes.",pass,"Covered by automated test suite (350 pass, 0 fail)",npm test,2026-07-08
147,Games,Live Market Event Options,As a player I want the “What happens next?” game to offer event-appropriate choices so that the prop is relevant.,"`app.js` reads `cfg.eventOptions` (fallback `['goal','corner','card','save']`) for the `next-event` game and `cfg.scorelineLabel` for `scoreline-lock`.",pass,Live market event options present in fit config,visual audit,2026-07-08
148,Games,Reaction Challenge Moments,As a player I want the reaction-tap game to use moments that match the event so that the challenge feels thematic.,`app.js` reads `cfg.reactionMoments`; if absent it falls back to `REACTION_DEFAULT_MOMENTS`.,pass,"Covered by automated test suite (350 pass, 0 fail)",npm test,2026-07-08
149,Shell,Embedded Shell Close Button,As a lobby user I want a visible back button when the shell opens inside the lobby so that I can return without closing the browser tab.,"When the shell is embedded (`self !== top`), `fit-loader.js` injects a `.shell-close-btn` into `.topbar` that posts `type: 'close-app'` to the parent.",pass,Added #closeShellBtn to titlebar; posts close-app message to parent lobby,puppeteer + visual check,2026-07-08
