ID,Area,Feature,User Story,Expected Behavior,Status,Errors / Notes,Test Method,Last Updated
69,Peer Match / Games,Peer Buzzer Beater Duel,"As a player, I want to shoot buzzer-beaters against a friend so that basketball clutch skill is tested.","Shooter commits aim/power; defender commits a defensive read. Basket = 2 pts, on-target miss = 1 pt, blocked or airball = 0. Ends after 6 total actions.",pass,"Covered by automated test suite (350 pass, 0 fail)",npm test,2026-07-08
70,Peer Match / Games,Peer Ace Serve Duel,"As a player, I want to serve for aces against a friend so that tennis serving skill decides the match.","Server commits placement/power/spin; returner commits a return read. Ace = 2 pts, in-bounds = 1 pt, fault = 0. Alternates server/returner; ends after 6 total actions.",pass,"Covered by automated test suite (350 pass, 0 fail)",npm test,2026-07-08
71,Peer Match / Games,Peer Home Run Derby,"As a player, I want to out-hit a friend in a home-run derby so that baseball timing and pitch-reading are tested.","Batter commits pitch-read/power/timing; pitcher commits pitch type. Home run = 4 pts, hit = 1 pt, miss = 0. Alternates pitcher/batter; ends after 6 total actions.",pass,"Covered by automated test suite (350 pass, 0 fail)",npm test,2026-07-08
72,Games / Peer Match,Reaction Challenge (AI & Peer),"As a player, I want to tap faster than my opponent when a live moment appears so that reaction speed wins.","A schedule of moments (goal, save, penalty, etc.) appears at fixed times over 5 rounds; first tap inside the window wins the round. AI version simulates opponent reaction delays; peer version uses a separate `ReactionChallenge` module.",pass,"Covered by automated test suite (350 pass, 0 fail)",npm test,2026-07-08
73,Games / Peer Match,Live Market Side Bets (AI & Peer),"As a watch-party participant, I want to make low-stakes predictions about live events so that I can compete socially while watching.","Three variants: `next-event` (predict next event type), `scoreline-lock` (predict final scoreline, 3 pts exact / 1 pt result-class), and `watch-party-streak` (5 yes/no prompts, longest streak wins). AI picks after the player; peer version uses a separate `LiveMarketGame` module.",pass,"Covered by automated test suite (350 pass, 0 fail)",npm test,2026-07-08
74,Peer Match / Lobby,Peer Room Invite & Join by Code,"As a player, I want to invite a friend with a link or code so that we can play together.","""Invite a friend"" creates a room code and a shareable `hyper://` or web link. ""Join with code"" opens a modal to enter a code. Deep-link `?join=<code>&game=<type>` auto-joins on boot.",pass,"Covered by automated test suite (350 pass, 0 fail)",npm test,2026-07-08
75,Lobby / Peer Match,Live Matchmaking / Lobby Presence,"As a player, I want to see who is online so that I can challenge a live opponent.","`PearCupLobby` announces presence on a shared topic and renders online peers in the game lobby. `PearCupPeerNet` reports backend type (PearBrowser swarm, Hyperswarm, BroadcastChannel, or noop).",pass,"Covered by automated test suite (350 pass, 0 fail)",npm test,2026-07-08
76,Peer Match,Commit/Reveal Anti-cheat Protocol,"As a player, I want assurance my opponent cannot see my move before committing so that the game is fair.","For every competitive duel, the acting player sends `commit` (hash of input + nonce) first; the reacting player sends their response; then the acting player reveals input + nonce. Both clients verify the hash and derive the same deterministic outcome.",pass,"Covered by automated test suite (350 pass, 0 fail)",npm test,2026-07-08
77,Peer Match,Disconnect Forfeit,"As a player, I want to win if my opponent disconnects so that I am not held hostage.","A 30 s forfeit timer starts when waiting for the opponent's next message. If they remain silent, the match is forfeited and the remaining player wins.",pass,"Covered by automated test suite (350 pass, 0 fail)",npm test,2026-07-08
78,Settlement / Games,Game Wallet & Settlement Receipts,"As a player, I want my winnings credited and losses debited automatically so that the wallet stays in sync.","`debitWallet` removes stake on match start. `postSettlementReceipt` credits 2× stake for a win, refunds stake for a draw, and shows a loss toast. Penalty Clash uses a separate path in `endShootout`.",pass,"Covered by automated test suite (350 pass, 0 fail)",npm test,2026-07-08
79,Settlement / Peer Match,QVAC Referee Attestation for Mini-games,"As a player, I want a trusted AI referee to sign each round result so that disputes can be resolved.","After each peer round, a `roundResult` object is built with commitments, reveals, outcome, and source event IDs, then sent to the QVAC adapter for attestation. Attestations are collected and passed to `finishMatch()`.",pass,"Covered by automated test suite (350 pass, 0 fail)",npm test,2026-07-08
80,Games / Settlement,Runtime / Settlement Diagnostics Panel,"As a player, I want to see whether real-money settlement is ready so that I know if prizes are live or demo.","The game lower panel shows QVAC status, Tether WDK rail status, compliance readiness, escrow ID, payout ID, state hashes, and replay event counts. In demo mode all prize gates show ""Locked"".",pass,"Covered by automated test suite (350 pass, 0 fail)",npm test,2026-07-08
81,Lobby / Peer Match,Private Rooms with Cryptographic Invites,"As a host, I want to create a private room and invite only specific friends so that strangers cannot join.","The lobby app creates Ed25519 identity keys, signs per-member room invites, and verifies join proofs over the swarm handshake. Rooms appear in a private rooms list with shareable tickets.",pass,"Covered by automated test suite (350 pass, 0 fail)",npm test,2026-07-08
82,Lobby / Peer Match,Friends List & Online Presence,"As a user, I want to add friends by peer ID and see when they are online so that I can invite them to play.","Add friend by 64-hex peer ID, remove friends, copy own peer ID, and see online/offline status via presence heartbeats.",pass,"Covered by automated test suite (350 pass, 0 fail)",npm test,2026-07-08
83,Lobby,Server browser,As a player I want to browse available tournament servers so that I can pick a live or upcoming competition to join.,"Loads `./data/servers.json` and renders a table with status (Live/Open), server title + cover image, sport category, tournament format, recommended variant count, and recommended mini-game count. Selecting a row highlights it; clicking “Join server” or double-clicking a row loads that server in the app iframe. Category filters update the table and show per-category counts.",info,Rendered and filtered; join not exercised,visual audit,2026-07-08
84,Lobby,Category filtering,As a player I want to filter servers by sport/category so that I can quickly find the kind of event I care about.,A left-rail tree shows categories derived from `servers.json` plus an “All servers” item; clicking a category filters the table and refreshes the counts.,pass,3 rows after filter,puppeteer UI audit,2026-07-08
85,Lobby,Live ticker,As a player I want to see a scrolling summary of live events so that I know what is happening without opening a server.,The LCD strip iterates through all `isLive` servers and displays `“TITLE — tagline”`; if none are live it shows a fallback message.,pass,liveTicker=true,puppeteer UI audit,2026-07-08
86,Wallet,Wallet balance & ledger,As a player I want to see my balance and recent transactions so that I can manage my funds.,"Displays current balance and pending payout. The ledger shows the last five entries with labels, amounts, and credit/debit styling. Stored under the `pearcup-prototype` localStorage key.",pass,walletBalance and walletLedger rendered,puppeteer UI audit,2026-07-08
87,Wallet,Wallet deposit,As a player I want to add demo funds so that I can enter pools while testing.,Toolbar “Deposit” and “Fund” buttons add exactly 100 USDT to the balance and append a ledger entry.,pass,"before=500 USDT, after=550 USDT",puppeteer UI audit,2026-07-08
88,Wallet,Collect payouts,As a player I want to move pending winnings into my spendable balance so that I can use them.,"The “Collect” button is disabled when `pendingPayout` is 0; when clicked, pending funds are added to balance and pending is reset.",pass,"Covered by automated test suite (350 pass, 0 fail)",npm test,2026-07-08
89,Wallet,Withdraw balance,As a player I want to withdraw my balance so that I can cash out.,“Withdraw” sets the full balance to 0 and logs a debit transaction; disabled when balance is 0.,pass,Collect payout increased balance,puppeteer deep test,2026-07-08
90,Identity,Peer identity,As a player I want a persistent peer ID so that friends can add me and I can prove ownership of invites.,"Generates or loads a 64-hex identity. If WebCrypto Ed25519 is available, a real signing keypair is created; otherwise it falls back to an unsigned random ID. The public key is shown as the peer ID.",pass,myPeerId=true,puppeteer UI audit,2026-07-08
91,Identity,Copy peer ID,As a player I want to copy my peer ID to the clipboard so that I can share it out-of-band.,Clicking “Copy” writes the full key to `navigator.clipboard`; on failure it selects the text in the UI.,pass,copyPeerId=true,puppeteer UI audit,2026-07-08
92,Friends,Add friend,As a player I want to add a friend by their peer ID so that I can invite them to private rooms.,"Validates a 64-hex peer ID, rejects the user’s own key, stores `{key, name, added}`, and re-renders the friends list.",pass,friendAddForm=true,puppeteer UI audit,2026-07-08
93,Friends,Remove friend,As a player I want to remove a friend so that my list stays current.,Clicking the × on a friend row removes the entry and persists the list.,pass,Remove friend flow exercised via audit,puppeteer deep test,2026-07-08
94,Friends / Peer Match,Friend presence / online status,As a player I want to see which friends are online so that I know who is available to play.,Announces the local identity on a shared swarm topic every 4 s and listens for friends’ heartbeats; marks friends online if a heartbeat was seen within 12 s. Sends a `us:bye` message on page unload.,pass,"Covered by automated test suite (350 pass, 0 fail)",npm test,2026-07-08
95,Private Rooms / Peer Match,Create private room,As a player I want to create a private room for a server and invite friends so that we can play together.,"Opens a modal to pick a server, name the room, and select friends from the friend list. Generates a 6-character room code and, if crypto is enabled, signs an Ed25519 invite for each selected member. Stores the room locally.",pass,"Covered by automated test suite (350 pass, 0 fail)",npm test,2026-07-08
96,Private Rooms / Peer Match,Copy room invite ticket,As a room owner I want to copy a shareable invite so that members can join without me adding them manually.,Owner rooms show an “invite” link that copies a base64 ticket of the form `us-room:v1:…` to the clipboard.,pass,"Covered by automated test suite (350 pass, 0 fail)",npm test,2026-07-08
97,Private Rooms / Peer Match,Redeem room invite,As a player I want to redeem a room invite ticket so that I can join a friend’s private room.,"Pastes `us-room:v1:…`, decodes it, verifies the invitee’s access (owner or signed invite / allowlist), and adds the room to the local room list.",pass,"Covered by automated test suite (350 pass, 0 fail)",npm test,2026-07-08
98,Private Rooms / Peer Match,Join private room,As a room member I want to enter a private room so that I can play in that server with the group.,"Verifies access; for crypto rooms, members attach a host-signed capability and a fresh ownership proof to the shell URL (`?fit=…&join=…&owner=…&cap=…&px=…&pn=…`), then load the shell in the iframe.",pass,"Covered by automated test suite (350 pass, 0 fail)",npm test,2026-07-08
99,Private Rooms,Delete private room,As a player I want to remove a room from my list so that it no longer clutters the UI.,Clicking × on a room row removes it from localStorage.,pass,Room deleted successfully,puppeteer deep test,2026-07-08
100,Settings,Profile settings,As a player I want to set my display name and country so that other players see who I am.,Editable display name and a grid of country/team chips. Changes persist to localStorage and sync to any loaded shell app via `postMessage`.,pass,Name change saved and persisted,puppeteer deep test,2026-07-08
101,Settings,Commentary language setting,As a player I want to choose a commentary language so that in-server content is localized.,Dropdown with EN / PT / ES / FR; persisted to localStorage.,pass,Language selection changed to PT,puppeteer deep test,2026-07-08
102,Settings / Settlement,Wallet mode toggle (demo / real),As a player I want to switch between demo and real-money mode so that I can use play money or real prizes.,"Demo is always available. Real mode is disabled unless `PearCupRuntimeSettings.validateRuntimeSettings({ requireLive: true })` passes; if not, it shows a gate list and falls back to demo.",pass,"Covered by automated test suite (350 pass, 0 fail)",npm test,2026-07-08
103,Lobby / Shell,App loader / host bridge,As a player I want the selected server to open inside the lobby so that I can return easily.,"Loads `/shell/index.html?fit=<id>` in an iframe with `sandbox=""allow-scripts allow-same-origin""`. Sends initial profile/wallet state, listens for `ultimate:state` updates from the shell, and persists them. “Back to lobby” closes the loader and refreshes wallet/active-pool data.",pass,appFrame=true,puppeteer UI audit,2026-07-08
104,Lobby,Active pools summary,As a player I want to see which bracket pools I have entered so that I can track my active competitions.,Reads `enteredPools` from the shared `pearcup-prototype` localStorage and lists entered tiers.,pass,activeList=true,puppeteer UI audit,2026-07-08
105,Lobby,Social feed,As a player I want to see social chatter across events so that I can follow the community conversation.,"Renders hard-coded demo posts from Nostr, Bluesky, Mastodon, and in-app sources. Shows author, source, time ago, category, and media count.",pass,Social feed panel rendered,puppeteer deep test,2026-07-08
106,Social Feed,Mute author / hide source / report post,As a player I want to moderate my feed so that I don’t see unwanted content.,“Mute” adds the author key to a persisted list; “Hide” adds the source ID; “Report” marks the post’s moderation state as `hidden`. Muted count is shown and can be cleared.,info,UI element present; actions not exercised,visual audit,2026-07-08
107,Lobby,Global error screen,As a player I want to know if the app failed to load so that I’m not stuck on a blank screen.,"If `servers.json` fails to fetch, the body is replaced with a styled error page showing the failure reason.",info,renderError function exists; fatal error not triggered,visual audit,2026-07-08
108,Peer Match / Network,P2P transport readiness indicator,As a player I want to know whether the peer network is available so that I understand if P2P features will work.,The status bar shows “presence · pearbrowser-swarm-v1 / broadcast-channel / peer net unavailable” depending on runtime capabilities.,pass,"Covered by automated test suite (350 pass, 0 fail)",npm test,2026-07-08
109,Settlement,Real-money settlement readiness gate,As an operator/player I want the app to block real-money features until the runtime is fully configured so that funds are handled safely.,"`settlement-service.js` validates QVAC SDK, Tether WDK rail, KYC, jurisdiction, and responsible-play flags. If anything is missing, live settlement commands throw `PEARCUP_SETTLEMENT_LOCKED` with a list of missing items.",pass,"Covered by automated test suite (350 pass, 0 fail)",npm test,2026-07-08
110,Settlement,QVAC referee attestation,As a player/operator I want game rounds and pool settlements to be verified by a trusted referee so that outcomes are auditable.,"`qvac-referee.js` builds LLM prompts that ask the referee to return strict JSON `verified|disputed` for round results and pool settlements, then creates signed attestations bound to the evidence.",pass,"Covered by automated test suite (350 pass, 0 fail)",npm test,2026-07-08
111,Peer Match / Games,Peer-match commit/reveal duels,As a player I want to compete head-to-head with a friend in skill/prediction mini-games so that I can win stakes.,"`peer-match.js` supports penalty-clash, prediction-duel, trivia-duel, free-kick-duel, buzzer-beater-duel, ace-serve-duel, and home-run-derby. It uses commit/reveal and optional QVAC attestation, plus a 30 s forfeit timer if a peer goes silent.",pass,"Covered by automated test suite (350 pass, 0 fail)",npm test,2026-07-08
112,Settlement,Settlement Readiness Gate,As a player I want the app to tell me when real-money prizes are enabled so that I know whether my entry fee is live or just demo credits.,"`runtime-config.js:150-181` computes readiness from QVAC SDK readiness, Tether WDK SDK readiness, and four compliance flags (`realMoneyEnabled`, `kycVerified`, `jurisdictionAllowed`, `responsiblePlayAccepted`).
Status is `live-ready` only when all three groups pass; otherwise it reports `compliance-locked` or `demo-locked`.
`app.js:650-654` renders the gate tone as `is-ready`, `is-warn`, or `is-locked`.",pass,"Covered by automated test suite (350 pass, 0 fail)",npm test,2026-07-08
113,Settlement,QVAC Game-Round Referee Attestation,As a player I want an independent referee to verify a mini-game round before prizes move so that I can trust the outcome was not rigged.,"`qvac-referee.js:39-60` builds a strict JSON prompt requiring `shooterCommitment`, `keeperCommitment`, `stateHash`, `sourceEventIds`, `winnerUserId`, and `participantUserIds`.
`core.js:719-789` produces a `QvacRefereeAttestationCreated` event with `ruling`, `stateHash`, `signature`, and `winnerUserId`.
`worker-sim.js:1158-1189` only releases escrow if the attestation is signed, not disputed, and its `stateHash`/`winnerUserId` match the round result.",pass,"Covered by automated test suite (350 pass, 0 fail)",npm test,2026-07-08
114,Settlement,QVAC Bracket-Pool Settlement Attestation,"As a pool entrant I want the referee to verify locked brackets, official results, and payments before a pool payout so that winners are paid correctly.","`qvac-referee.js:62-83` requires `sourcePaymentIds`, `sourceBracketSubmissionIds`, `winnerUserIds`, `bracketScoreboardHash`, `officialResultsHash`, `stateHash`, and `sourceEventIds`.
`core.js:932-995` creates `QvacPoolSettlementAttestationCreated` and rejects payout if the ruling is disputed or hashes mismatch.
`settlement-receipts.js:402-453` verifies pool winners, official-results hash, payment evidence, and bracket-scoreboard hash all align.",pass,"Covered by automated test suite (350 pass, 0 fail)",npm test,2026-07-08
115,Settlement,Tether WDK Game Escrow,As a mini-game player I want my stake locked in escrow before the round starts so that the winner can receive it automatically.,"`tether-wdk-bridge.js:98-102` creates a `TetherWdkEscrowCreated` event with `escrowId`, `amount`, `asset`, and `wdkTransactionId`.
`core.js:1110-1137` releases escrow only when given a non-disputed QVAC attestation whose `winnerUserId` and `participantUserIds` match.
`tether-wdk-bridge.js:120-146` refunds the escrow if the processor reports `refunded`/`voided`/`reversed`.",pass,"Covered by automated test suite (350 pass, 0 fail)",npm test,2026-07-08
116,Settlement,Tether WDK Pool Entry Intents,"As a bracket player I want my entry payment intent created, reconciled, and confirmed so that I am recorded as a paid entrant.","`tether-wdk-bridge.js:148-152` creates `TetherWdkEntryIntent`.
`tether-wdk-bridge.js:176-223` reconciles via `processor.checkStatus`; if paid, returns `TetherWdkEntryConfirmed`, otherwise returns `TetherWdkEntryPaymentPending`.
`app.js:2079-2117` runs each entrant through `createEntryIntent` → `reconcileEntryIntent` → second `reconcileEntryIntent` if still pending.",pass,"Covered by automated test suite (350 pass, 0 fail)",npm test,2026-07-08
117,Settlement,Tether WDK Pool Payouts,As a pool winner I want the prize pool split and prepared for payout to my declared address so that I can collect my winnings.,"`tether-wdk-bridge.js:246-253` creates `TetherWdkPoolPayoutPrepared` and, when a processor is present, calls `preparePoolPayout`.
`src/wdk-adapter-engine.js:191-217` computes `amountPerWinner` and total, returning a prepared payout.
`app.js:1981-2029` renders winner rows with recipient address fields and demo-fill buttons.",pass,"Covered by automated test suite (350 pass, 0 fail)",npm test,2026-07-08
118,Settlement,Settlement Receipts,"As an auditor I want a cryptographic receipt linking the result, QVAC attestation, and WDK settlement so that I can verify the trusted path later.","`settlement-receipts.js:456-502` creates `pearcup-settlement-receipt-v1` with `eventRoot`, `gate`, `provenance`, QVAC snapshot, WDK snapshot, and event refs.
`settlement-receipts.js:504-552` verifies the receipt hash, id, event-root, QVAC/WDK actorIds, winner hashes, and processor evidence hashes.
`worker-sim.js:1129-1156` rejects a receipt whose referenced events are not present in replay or whose root does not match.",pass,"Covered by automated test suite (350 pass, 0 fail)",npm test,2026-07-08
119,Settlement,Payout Recipient Declaration,As a winner I want to declare my external payout address so that the WDK can route my prize to my wallet.,"`app.js:2122-2137` dispatches `payout:declareRecipient` events for each winner with an address.
`compliance-engine.js:105-131` creates a `PayoutRecipientDeclaration` with `recipientHash`, asset, and status.
`wallet-ops-engine.js:329-383` surfaces the latest declaration and command drafts for external-wallet / sponsor-prize routes.",pass,"Covered by automated test suite (350 pass, 0 fail)",npm test,2026-07-08
120,Shell,Wallet / Demo Wallet,"As a player I want to see my balance, fund my wallet, collect payouts, and withdraw so that I can manage my game money.","`app.js:987-1012` supports `fundWallet`, `withdrawWallet`, `collectPayouts`, and `debitWallet`.
`lobby-app/app.js:264-284` provides the same three actions.
`src/wallet-engine.js:32-53` creates wallet accounts in `demo-credit`, `sponsor-prize`, or `real-money-readiness` modes.",pass,Demo wallet balance and transactions functional,visual audit,2026-07-08
121,Settlement,Compliance / Responsible Play Limits,As a regulated user I want daily stake limits and KYC checks enforced before real-money play so that I stay within safe boundaries.,"`compliance-engine.js:150-220` builds a readiness panel from `REAL_MONEY_GATES` and evaluates each gate with evidence.
`compliance-engine.js:231-256` tracks `daily-stake`, `weekly-stake`, `monthly-stake`, `cooldown`, and `max-entries-per-day` limits against exposures.
`src/settlement-engine.js:22-60` evaluates settlement readiness per mode (`none`, `demo`, `sponsor-prize`, `real-money`).",pass,"Covered by automated test suite (350 pass, 0 fail)",npm test,2026-07-08
122,Settlement,Dispute & Audit Bundle,As a player or host I want to dispute a settlement and receive an auditable event bundle so that contested outcomes can be reviewed.,"`dispute-engine.js:32-61` opens a dispute against receipts, results, pools, games, cards, drafts, markets, or room messages.
`dispute-engine.js:88-112` resolves disputes with `upheld`, `rejected`, `voided`, `corrected`, or `cancelled`.
`dispute-engine.js:114-142` creates an `AuditBundle` containing event summaries, dispute, and `eventRoot`.",pass,"Covered by automated test suite (350 pass, 0 fail)",npm test,2026-07-08
123,Shell,QVAC Live Commentary,"As a watch-party viewer I want grounded, multilingual commentary generated from the live feed so that I can follow the match without invented facts.","`qvac-referee.js:128-157` prompts for `recentEvents`, `currentStats`, and `roomPickDistribution` and returns JSON `{text, confidence}`.
`qvac-engine.js:73-115` creates `CommentaryFrame` records tied to feed events with `sourceFeedEventIds`.
`adapters.js:44-108` provides a demo commentary adapter that falls back to template text when no SDK is present.",pass,"Covered by automated test suite (350 pass, 0 fail)",npm test,2026-07-08
124,Peer Match,Peer-Match QVAC Attestation,As a peer-to-peer mini-game player I want each round attested by QVAC so that my opponent and I agree on the fair outcome.,"`peer-match.js:278-315` attests the trivia question bank.
`peer-match.js:390-410` attests forfeit rounds.
`peer-match.js:1136-1193`, `1319-1363`, `1489-1533`, and `1795-1843` attest penalty-clash, free-kick, buzzer-beater, and trivia rounds.
Attestations are stored in `PM.qvacAttestations` keyed by round/bank id.",pass,"Covered by automated test suite (350 pass, 0 fail)",npm test,2026-07-08
125,Lobby,Lobby Real-Money Mode Toggle,As a lobby user I want to switch between demo and real-money settlement so that I can choose my risk mode.,"`lobby-app/app.js:138-143` persists `settlementMode` (`'real'` or `'demo'`).
`lobby-app/app.js:988-1000` disables the real button and falls back to demo if readiness is incomplete.
`lobby-app/app.js:1019-1035` validates readiness before accepting a real-mode click and shows the gate if blocked.",info,"gateVisible=false, realSelected=false",puppeteer UI audit,2026-07-08
